{
  "$id": "authoritative-replay.v4.schema.json",
  "$schema": "https://json-schema.org/draft/2020-12/schema",
  "additionalProperties": false,
  "$defs": {
    "uint": {"pattern": "^(0|[1-9][0-9]*)$", "type": "string"},
    "digest": {"pattern": "^[0-9a-f]{64}$", "type": "string"},
    "u32": {"maximum": 4294967295, "minimum": 0, "type": "integer"},
    "i64": {"maximum": 9223372036854775807, "minimum": -9223372036854775808, "type": "integer"},
    "u64": {"maximum": 18446744073709551615, "minimum": 0, "type": "integer"},
    "counters": {"additionalProperties": false, "properties": {"accepted_transitions": {"$ref": "#/$defs/u64"}, "decisions_submitted": {"$ref": "#/$defs/u64"}, "resource_units_consumed": {"$ref": "#/$defs/u64"}, "rule_events_emitted": {"$ref": "#/$defs/u64"}, "wall_clock_elapsed_millis": {"$ref": "#/$defs/u64"}}, "required": ["decisions_submitted", "accepted_transitions", "rule_events_emitted", "resource_units_consumed", "wall_clock_elapsed_millis"], "type": "object"},
    "outcome": {"additionalProperties": false, "properties": {"player": {"$ref": "#/$defs/uint"}, "result": {"enum": ["win", "loss", "draw", "eliminated", "unresolved"]}}, "required": ["player", "result"], "type": "object"},
    "status": {"oneOf": [{"additionalProperties": false, "properties": {"kind": {"const": "running"}}, "required": ["kind"], "type": "object"}, {"additionalProperties": false, "properties": {"kind": {"const": "terminal"}, "players": {"items": {"$ref": "#/$defs/outcome"}, "type": "array"}, "reason": {"enum": ["rules_loss", "concession", "simultaneous_outcome", "rules_draw", "specified_loop"]}}, "required": ["kind", "reason", "players"], "type": "object"}, {"additionalProperties": false, "properties": {"kind": {"const": "truncated"}, "players": {"items": {"$ref": "#/$defs/outcome"}, "type": "array"}, "reason": {"enum": ["decision_limit", "rule_event_limit", "wall_clock_limit", "resource_limit", "external_stop"]}}, "required": ["kind", "reason", "players"], "type": "object"}]},
    "codec_identity": {"additionalProperties": false, "properties": {"codec_id": {"minLength": 1, "type": "string"}, "semantic_version": {"minLength": 1, "type": "string"}}, "required": ["codec_id", "semantic_version"], "type": "object"},
    "identity": {"additionalProperties": false, "properties": {"checkpoint_codec_identity": {"$ref": "#/$defs/codec_identity"}, "checkpoint_digest": {"$ref": "#/$defs/digest"}, "environment_limit_counters": {"$ref": "#/$defs/counters"}, "episode_status": {"$ref": "#/$defs/status"}, "full_state_digest": {"$ref": "#/$defs/digest"}, "state_revision": {"$ref": "#/$defs/uint"}}, "required": ["state_revision", "full_state_digest", "episode_status", "environment_limit_counters", "checkpoint_codec_identity", "checkpoint_digest"], "type": "object"},
    "schemas": {"additionalProperties": false, "properties": {"decision": {"const": "player-decision-request.v2"}, "decision_response": {"const": "decision-response.v2"}, "information_state": {"const": "information-state-envelope.v2"}, "observation": {"const": "observation-envelope.v1"}, "observation_payload_codec": {"const": "synthetic-m3-observation.v1"}, "observed_event": {"const": "observed-event-envelope.v2"}, "player_step": {"const": "player-step.v2"}, "replay_step": {"const": "replay-step.v4"}}, "required": ["observation", "observation_payload_codec", "information_state", "decision", "decision_response", "observed_event", "player_step", "replay_step"], "type": "object"},
    "kernel": {"additionalProperties": false, "properties": {"build_profile": {"minLength": 1, "type": "string"}, "implementation_id": {"minLength": 1, "type": "string"}, "semantic_version": {"minLength": 1, "type": "string"}}, "required": ["implementation_id", "semantic_version", "build_profile"], "type": "object"},
    "randomness": {"additionalProperties": false, "properties": {"contract_id": {"const": "mtgml.rng.v1"}, "root_seed_hex": {"$ref": "#/$defs/digest"}}, "required": ["contract_id", "root_seed_hex"], "type": "object"},
    "deck": {"additionalProperties": false, "properties": {"deck_id": {"minLength": 1, "type": "string"}, "digest": {"$ref": "#/$defs/digest"}, "player": {"$ref": "#/$defs/uint"}}, "required": ["player", "deck_id", "digest"], "type": "object"},
    "answer": {"oneOf": [{"additionalProperties": false, "properties": {"candidate_id": {"$ref": "#/$defs/u32"}, "kind": {"const": "select_one"}}, "required": ["kind", "candidate_id"], "type": "object"}, {"additionalProperties": false, "properties": {"candidate_ids": {"items": {"$ref": "#/$defs/u32"}, "type": "array"}, "kind": {"const": "select_many"}}, "required": ["kind", "candidate_ids"], "type": "object"}, {"additionalProperties": false, "properties": {"kind": {"const": "choose_number"}, "value": {"$ref": "#/$defs/i64"}}, "required": ["kind", "value"], "type": "object"}, {"additionalProperties": false, "properties": {"candidate_ids": {"items": {"$ref": "#/$defs/u32"}, "type": "array"}, "kind": {"const": "order"}}, "required": ["kind", "candidate_ids"], "type": "object"}]},
    "response": {"additionalProperties": false, "properties": {"answer": {"$ref": "#/$defs/answer"}, "player_decision_id": {"$ref": "#/$defs/uint"}, "schema_version": {"const": "decision-response.v2"}, "state_revision": {"$ref": "#/$defs/uint"}}, "required": ["schema_version", "player_decision_id", "state_revision", "answer"], "type": "object"},
    "step": {"additionalProperties": false, "properties": {"accepted": {"type": "boolean"}, "actor": {"$ref": "#/$defs/uint"}, "checkpoint_digest_after": {"$ref": "#/$defs/digest"}, "checkpoint_digest_before": {"$ref": "#/$defs/digest"}, "environment_limit_counters_after": {"$ref": "#/$defs/counters"}, "episode_status_after": {"$ref": "#/$defs/status"}, "full_state_digest_after": {"$ref": "#/$defs/digest"}, "response": {"$ref": "#/$defs/response"}, "state_revision_after": {"$ref": "#/$defs/uint"}, "state_revision_before": {"$ref": "#/$defs/uint"}, "step_index": {"$ref": "#/$defs/u64"}}, "required": ["step_index", "actor", "checkpoint_digest_before", "state_revision_before", "response", "accepted", "state_revision_after", "full_state_digest_after", "episode_status_after", "environment_limit_counters_after", "checkpoint_digest_after"], "type": "object"},
    "manifest": {"additionalProperties": false, "properties": {"card_bundle": {"minLength": 1, "type": "string"}, "decks": {"items": {"$ref": "#/$defs/deck"}, "minItems": 1, "type": "array"}, "engine_build": {"minLength": 1, "type": "string"}, "format_policy_snapshot": {"minLength": 1, "type": "string"}, "initial_identity": {"$ref": "#/$defs/identity"}, "kernel": {"$ref": "#/$defs/kernel"}, "oracle_snapshot": {"minLength": 1, "type": "string"}, "randomness": {"$ref": "#/$defs/randomness"}, "rules_snapshot": {"minLength": 1, "type": "string"}, "schema_version": {"const": "replay-manifest.v4"}, "schemas": {"$ref": "#/$defs/schemas"}}, "required": ["schema_version", "engine_build", "kernel", "rules_snapshot", "format_policy_snapshot", "oracle_snapshot", "card_bundle", "schemas", "randomness", "decks", "initial_identity"], "type": "object"}
  },
  "properties": {
    "final_identity": {"$ref": "#/$defs/identity"},
    "manifest": {"$ref": "#/$defs/manifest"},
    "schema_version": {"const": "authoritative-replay.v4"},
    "steps": {"items": {"$ref": "#/$defs/step"}, "type": "array"}
  },
  "required": ["schema_version", "manifest", "steps", "final_identity"],
  "title": "AuthoritativeReplay V4",
  "type": "object"
}
