{"final_identity":{"checkpoint_codec_identity":{"codec_id":"in-memory-reference","semantic_version":"4"},"checkpoint_digest":"8e24ae4933f04d8b93f4afa4d76711ce9109112c21a05f8c90164564cf5b5f2c","environment_limit_counters":{"accepted_transitions":0,"decisions_submitted":0,"resource_units_consumed":0,"rule_events_emitted":0,"wall_clock_elapsed_millis":0},"episode_status":{"kind":"running"},"full_state_digest":"0000000000000000000000000000000000000000000000000000000000000000","state_revision":"0"},"manifest":{"card_bundle":"bundle:synthetic-v1","decks":[{"deck_id":"deck:synthetic-p1","digest":"0000000000000000000000000000000000000000000000000000000000000000","player":"1"}],"engine_build":"git:0000000","format_policy_snapshot":"commander:synthetic-v1","initial_identity":{"checkpoint_codec_identity":{"codec_id":"in-memory-reference","semantic_version":"4"},"checkpoint_digest":"8e24ae4933f04d8b93f4afa4d76711ce9109112c21a05f8c90164564cf5b5f2c","environment_limit_counters":{"accepted_transitions":0,"decisions_submitted":0,"resource_units_consumed":0,"rule_events_emitted":0,"wall_clock_elapsed_millis":0},"episode_status":{"kind":"running"},"full_state_digest":"0000000000000000000000000000000000000000000000000000000000000000","state_revision":"0"},"kernel":{"build_profile":"test","implementation_id":"mtgml-reference","semantic_version":"0.2.2"},"oracle_snapshot":"oracle:synthetic-v1","randomness":{"contract_id":"mtgml.rng.v1","root_seed_hex":"0000000000000000000000000000000000000000000000000000000000000000"},"rules_snapshot":"cr:synthetic-v1","schema_version":"replay-manifest.v4","schemas":{"decision":"player-decision-request.v2","decision_response":"decision-response.v2","information_state":"information-state-envelope.v2","observation":"observation-envelope.v1","observation_payload_codec":"synthetic-m3-observation.v1","observed_event":"observed-event-envelope.v2","player_step":"player-step.v2","replay_step":"replay-step.v4"}},"schema_version":"authoritative-replay.v4","steps":[]}